{
  "schema_version": "1.0.0",
  "entry_id": "LiH_sto3g_JW_geom_v1__sha256_c35fe44ce005413d",
  "created_utc": "2025-12-31T08:40:26Z",
  "source": {
    "generator": {
      "name": "qencode-db",
      "version": "0.1.0",
      "git_commit": "local"
    },
    "software": {
      "python": "local",
      "qiskit": "2.2.3",
      "qiskit_nature": "0.7.2",
      "pyscf": "2.11.0"
    }
  },
  "problem": {
    "type": "molecule",
    "name": "LiH",
    "geometry": {
      "units": "angstrom",
      "atoms": [
        {
          "element": "Li",
          "xyz": [
            0.0,
            0.0,
            0.0
          ]
        },
        {
          "element": "H",
          "xyz": [
            0.0,
            0.0,
            1.6
          ]
        }
      ]
    },
    "charge": 0,
    "multiplicity": 1,
    "basis": "sto3g",
    "mapping": "jordan_wigner"
  },
  "settings": {
    "chemistry": {
      "basis": "sto3g",
      "driver": "pyscf",
      "reference_method": "hf"
    },
    "reduction": {
      "freeze_core": false,
      "active_space": null
    },
    "mapping": {
      "type": "jordan_wigner",
      "two_qubit_reduction": false,
      "z2_symmetry_reduction": false
    },
    "ansatz": {
      "type": "uccsd",
      "initial_state": "hartree_fock",
      "reps": 1
    },
    "estimation": {
      "shots": 0,
      "backend": "statevector_simulator"
    },
    "ansatz_reps": 1,
    "ansatz_type": "uccsd"
  },
  "artifacts": {
    "qubit_hamiltonian": {
      "num_qubits": 12,
      "format": "pauli_sum",
      "pauli_terms": [
        {
          "pauli": "IIIIIIIIIIII",
          "coeff": -5.128074449940938
        },
        {
          "pauli": "IIIIIIIIIIIZ",
          "coeff": 1.0064988767033303
        },
        {
          "pauli": "IIIIIIIIIIZI",
          "coeff": -0.11846053900005304
        },
        {
          "pauli": "IIIIIIIIIIZZ",
          "coeff": 0.08834086551993083
        },
        {
          "pauli": "IIIIIIIIIYYI",
          "coeff": -0.007477511052717769
        },
        {
          "pauli": "IIIIIIIIIYYZ",
          "coeff": -0.0005588753820190705
        },
        {
          "pauli": "IIIIIIIIIXXI",
          "coeff": -0.007477511052717769
        },
        {
          "pauli": "IIIIIIIIIXXZ",
          "coeff": -0.0005588753820190705
        },
        {
          "pauli": "IIIIIIYZZZYI",
          "coeff": 0.005309225832508476
        },
        {
          "pauli": "IIIIIIYZZZYZ",
          "coeff": 0.00814755367376419
        },
        {
          "pauli": "IIIIIIXZZZXI",
          "coeff": 0.005309225832508476
        },
        {
          "pauli": "IIIIIIXZZZXZ",
          "coeff": 0.00814755367376419
        },
        {
          "pauli": "IIIIIIIIIZII",
          "coeff": -0.19809729990207903
        },
        {
          "pauli": "IIIIIIIIIZIZ",
          "coeff": 0.09349286855279958
        },
        {
          "pauli": "IIIIIIYZZYII",
          "coeff": 0.014686660276427033
        },
        {
          "pauli": "IIIIIIYZZYIZ",
          "coeff": -0.005005436536370917
        },
        {
          "pauli": "IIIIIIXZZXII",
          "coeff": 0.014686660276427033
        },
        {
          "pauli": "IIIIIIXZZXIZ",
          "coeff": -0.005005436536370917
        },
        {
          "pauli": "IIIIIIIIZIII",
          "coeff": -0.23046822629623342
        },
        {
          "pauli": "IIIIIIIIZIIZ",
          "coeff": 0.09662537527153493
        },
        {
          "pauli": "IIIIIIIZIIII",
          "coeff": -0.23046822629623376
        },
        {
          "pauli": "IIIIIIIZIIIZ",
          "coeff": 0.0966253752715349
        },
        {
          "pauli": "IIIIIIZIIIII",
          "coeff": -0.3850053250190644
        },
        {
          "pauli": "IIIIIIZIIIIZ",
          "coeff": 0.0882953859984229
        },
        {
          "pauli": "IIIIIZIIIIII",
          "coeff": 1.0064988767033298
        },
        {
          "pauli": "IIIIIZIIIIIZ",
          "coeff": 0.4146416717146752
        },
        {
          "pauli": "IIIIYYIIIIII",
          "coeff": 0.014319294514921196
        },
        {
          "pauli": "IIIIYYIIIIIZ",
          "coeff": 0.027927494526499782
        },
        {
          "pauli": "IIIIXXIIIIII",
          "coeff": 0.014319294514921196
        },
        {
          "pauli": "IIIIXXIIIIIZ",
          "coeff": 0.027927494526499782
        },
        {
          "pauli": "IIIYZYIIIIII",
          "coeff": 0.025347729903460757
        },
        {
          "pauli": "IIIYZYIIIIIZ",
          "coeff": 0.034643657120824546
        },
        {
          "pauli": "IIIXZXIIIIII",
          "coeff": 0.025347729903460757
        },
        {
          "pauli": "IIIXZXIIIIIZ",
          "coeff": 0.034643657120824546
        },
        {
          "pauli": "YZZZZYIIIIII",
          "coeff": -0.0016662986505437943
        },
        {
          "pauli": "YZZZZYIIIIIZ",
          "coeff": -0.01326125568671431
        },
        {
          "pauli": "XZZZZXIIIIII",
          "coeff": -0.0016662986505437943
        },
        {
          "pauli": "XZZZZXIIIIIZ",
          "coeff": -0.01326125568671431
        },
        {
          "pauli": "IIIIZIIIIIII",
          "coeff": -0.11846053900005327
        },
        {
          "pauli": "IIIIZIIIIIIZ",
          "coeff": 0.09167526013040869
        },
        {
          "pauli": "IIIYYIIIIIII",
          "coeff": -0.007477511052717769
        },
        {
          "pauli": "IIIYYIIIIIIZ",
          "coeff": -0.003362819036704882
        },
        {
          "pauli": "IIIXXIIIIIII",
          "coeff": -0.007477511052717769
        },
        {
          "pauli": "IIIXXIIIIIIZ",
          "coeff": -0.003362819036704882
        },
        {
          "pauli": "YZZZYIIIIIII",
          "coeff": 0.005309225832508469
        },
        {
          "pauli": "YZZZYIIIIIIZ",
          "coeff": 0.010374222324993064
        },
        {
          "pauli": "XZZZXIIIIIII",
          "coeff": 0.005309225832508469
        },
        {
          "pauli": "XZZZXIIIIIIZ",
          "coeff": 0.010374222324993064
        },
        {
          "pauli": "IIIZIIIIIIII",
          "coeff": -0.19809729990207903
        },
        {
          "pauli": "IIIZIIIIIIIZ",
          "coeff": 0.09890842981015947
        },
        {
          "pauli": "YZZYIIIIIIII",
          "coeff": 0.014686660276427031
        },
        {
          "pauli": "YZZYIIIIIIIZ",
          "coeff": -0.0044164590965098255
        },
        {
          "pauli": "XZZXIIIIIIII",
          "coeff": 0.014686660276427031
        },
        {
          "pauli": "XZZXIIIIIIIZ",
          "coeff": -0.0044164590965098255
        },
        {
          "pauli": "IIZIIIIIIIII",
          "coeff": -0.23046822629623354
        },
        {
          "pauli": "IIZIIIIIIIIZ",
          "coeff": 0.09907984596068785
        },
        {
          "pauli": "IZIIIIIIIIII",
          "coeff": -0.23046822629623354
        },
        {
          "pauli": "IZIIIIIIIIIZ",
          "coeff": 0.09907984596068782
        },
        {
          "pauli": "ZIIIIIIIIIII",
          "coeff": -0.38500532501906465
        },
        {
          "pauli": "ZIIIIIIIIIIZ",
          "coeff": 0.09043276301476445
        },
        {
          "pauli": "IIIIIIIIIYZY",
          "coeff": 0.025347729903460785
        },
        {
          "pauli": "IIIIIIIIIYIY",
          "coeff": 0.0031296735242086235
        },
        {
          "pauli": "IIIIIIIIIXZX",
          "coeff": 0.025347729903460785
        },
        {
          "pauli": "IIIIIIIIIXIX",
          "coeff": 0.0031296735242086235
        },
        {
          "pauli": "IIIIIIYZZZZY",
          "coeff": -0.0016662986505438012
        },
        {
          "pauli": "IIIIIIYZZZIY",
          "coeff": 0.0028825606312715382
        },
        {
          "pauli": "IIIIIIXZZZZX",
          "coeff": -0.0016662986505438012
        },
        {
          "pauli": "IIIIIIXZZZIX",
          "coeff": 0.0028825606312715382
        },
        {
          "pauli": "IIIIIIIIIIYY",
          "coeff": 0.014319294514921217
        },
        {
          "pauli": "IIIIIIIIIZYY",
          "coeff": 0.0028028345115977925
        },
        {
          "pauli": "IIIIIIIIIIXX",
          "coeff": 0.014319294514921217
        },
        {
          "pauli": "IIIIIIIIIZXX",
          "coeff": 0.0028028345115977925
        },
        {
          "pauli": "IIIIIIYZZYYY",
          "coeff": -0.0013390191284573185
        },
        {
          "pauli": "IIIIIIXZZXYY",
          "coeff": -0.0010566097619743283
        },
        {
          "pauli": "IIIIIIYZZXXY",
          "coeff": -0.00028240936648299034
        },
        {
          "pauli": "IIIIIIXZZYYX",
          "coeff": -0.00028240936648299034
        },
        {
          "pauli": "IIIIIIYZZYXX",
          "coeff": -0.0010566097619743283
        },
        {
          "pauli": "IIIIIIXZZXXX",
          "coeff": -0.0013390191284573185
        },
        {
          "pauli": "IIIIIIIIZIYY",
          "coeff": 0.002961067075974595
        },
        {
          "pauli": "IIIIIIIIZIXX",
          "coeff": 0.002961067075974595
        },
        {
          "pauli": "IIIIIIIZIIYY",
          "coeff": 0.002961067075974595
        },
        {
          "pauli": "IIIIIIIZIIXX",
          "coeff": 0.002961067075974595
        },
        {
          "pauli": "IIIIIIZIIIYY",
          "coeff": -0.0007881117662221803
        },
        {
          "pauli": "IIIIIIZIIIXX",
          "coeff": -0.0007881117662221803
        },
        {
          "pauli": "IIIIIZIIIIYY",
          "coeff": 0.027927494526499782
        },
        {
          "pauli": "IIIIIZIIIIXX",
          "coeff": 0.027927494526499782
        },
        {
          "pauli": "IIIIYYIIIIYY",
          "coeff": 0.003334394610477861
        },
        {
          "pauli": "IIIIXXIIIIYY",